{
  "schema_version": 1,
  "kind": "ortak_kopru_rafine_sorulari",
  "konu": "Ortak Köprü deposunun şimdiki tanımı ve rafine sonrası olabilecek tanımı",
  "hazirlayan": "Claude Code Bulut (Hacker odağı)",
  "hazirlandi": "2026-10-28T12:00:57Z",
  "kesit": {
    "dal": "claude/rafine-2026-10-28",
    "pr": 23,
    "temel_commit": "97c908de7a5850978082770ba3bac3e508688e57"
  },
  "sorular": [
    {
      "kok": "ne",
      "soru": "Ne?",
      "varyantlar": [
        {
          "id": "ne.merkez",
          "soru": "Merkezinde ne var?",
          "anlam": "Diğer parçaların dayandığı tek öğeyi arar."
        },
        {
          "id": "ne.degil",
          "soru": "Ne değildir?",
          "anlam": "Tanımın sınırını, deponun iddia etmediğini arar."
        }
      ]
    },
    {
      "kok": "nerede",
      "soru": "Nerede?",
      "varyantlar": [
        {
          "id": "nerede.calisir",
          "soru": "Nerede çalışır?",
          "anlam": "Kodun gerçekten yürüdüğü ortamları arar; dosyanın durduğu yerden ayrıdır."
        },
        {
          "id": "nerede.gorulemez",
          "soru": "Nerede görülemez?",
          "anlam": "Bu gözlemin erişemediği, yalnız beyanla bilinen yerleri arar."
        }
      ]
    },
    {
      "kok": "ne_zaman",
      "soru": "Ne zaman?",
      "varyantlar": [
        {
          "id": "ne_zaman.beri",
          "soru": "Ne zamandan beri?",
          "anlam": "Bir etkinliğin ya da sessizliğin başladığı anı arar."
        },
        {
          "id": "ne_zaman.bozulur",
          "soru": "Ne zaman bozulur?",
          "anlam": "Hangi olayda tanımın ya da aracın kırılacağını arar."
        }
      ]
    },
    {
      "kok": "ne_kadar",
      "soru": "Ne kadar?",
      "varyantlar": [
        {
          "id": "ne_kadar.buyur",
          "soru": "Ne kadar büyür?",
          "anlam": "Büyüklüğün kendisini değil hızını ve neyin büyüttüğünü arar."
        },
        {
          "id": "ne_kadar.acik",
          "soru": "Ne kadarı açık?",
          "anlam": "Bekleyen, karar isteyen veya cevapsız kalan payı arar."
        }
      ]
    },
    {
      "kok": "nereden",
      "soru": "Nereden?",
      "varyantlar": [
        {
          "id": "nereden.giris",
          "soru": "Nereden girer?",
          "anlam": "İçeriğin depoya hangi yollardan girdiğini arar."
        },
        {
          "id": "nereden.yetki",
          "soru": "Yetki nereden gelir?",
          "anlam": "Bir işin yapılmasını kimin başlattığını arar; içeriğin kaynağından ayrıdır."
        }
      ]
    },
    {
      "kok": "neden",
      "soru": "Neden?",
      "varyantlar": [
        {
          "id": "neden.simdi",
          "soru": "Neden şimdi?",
          "anlam": "Zamanlamanın gerekçesini arar."
        },
        {
          "id": "neden.degil",
          "soru": "Neden başka türlü değil?",
          "anlam": "Seçilmeyen yolu ve neden seçilmediğini arar."
        }
      ]
    },
    {
      "kok": "nasil",
      "soru": "Nasıl?",
      "varyantlar": [
        {
          "id": "nasil.sinanir",
          "soru": "Nasıl sınanır?",
          "anlam": "Bir iddianın hangi denetimle kırılabileceğini arar."
        },
        {
          "id": "nasil.geri_alinir",
          "soru": "Nasıl geri alınır?",
          "anlam": "Bir değişikliğin izi silinmeden nasıl geri çevrileceğini, geri alınamayan bir şey bırakıp bırakmadığını arar."
        }
      ]
    },
    {
      "kok": "ne_icin",
      "soru": "Ne için?",
      "varyantlar": [
        {
          "id": "ne_icin.kimin",
          "soru": "Kimin için?",
          "anlam": "Amacın sahibini arar; her kullanıcının amacı ayrıdır."
        },
        {
          "id": "ne_icin.degil",
          "soru": "Ne için değildir?",
          "anlam": "Amacın sınırını, beklenmemesi gereken kullanımı arar."
        }
      ]
    },
    {
      "kok": "nereye",
      "soru": "Nereye?",
      "varyantlar": [
        {
          "id": "nereye.sonraki",
          "soru": "Sonraki adım nereye?",
          "anlam": "Belgelenmiş ya da karar bekleyen yönü arar."
        },
        {
          "id": "nereye.gitmez",
          "soru": "Nereye gitmez?",
          "anlam": "Çıkmaması gereken yeri ve bu sınırın nasıl korunduğunu arar."
        }
      ]
    }
  ],
  "simdi": {
    "ne": {
      "yanit": "Ana dalda Ortak Köprü, değişmeyen ve numaralı kayıtlardan oluşan bir HTML defterinin çevresine kurulmuş, seçilmiş içeriği yerel ile GitHub arasında taşıyan, isteğe bağlı bir iş takibi ve dış okuyucuya açılan beş sayfalık bir yayın taşıyan herkese açık bir depodur.",
      "ogeler": [
        {
          "ad": "Kanonik defter",
          "varyant": "ne.merkez",
          "aciklama": "kopru.html 179 imzalı kayıt taşır; kayıtlar değiştirilmez, düzeltme yeni kayıtla ve eskisine yanıt bağıyla gelir.",
          "durum": "gözlendi",
          "dayanak": "kopru.html",
          "olcum": "kopru_kaydi"
        },
        {
          "ad": "Dört iş alanı",
          "aciklama": "Dış alan kapısı (kapi.py), deus_ex_machina iş bileşeni (deus.py ve src/ortak_kopru), katılımcı otomasyonu (kopru_yanitla.py) ve dış okuyucu yayını (tools/okuma_yayini_uret.py).",
          "durum": "gözlendi",
          "dayanak": "README.md"
        },
        {
          "ad": "Ne değildir",
          "varyant": "ne.degil",
          "aciklama": "Bir modelin kesintisiz belleği, hedef bilgisayarda sürekli çalışan bir sistem ya da katılımcıların özel düşünme dökümü değildir; belgeler bu sınırları açıkça yazar.",
          "durum": "beyan",
          "dayanak": "docs/SON_DURUM.md"
        },
        {
          "ad": "Belge olarak kalan sözleşmeler",
          "aciklama": "schemas/ altındaki altı JSON sözleşmesini ana dalda hiçbir kod veya test okumaz; kod sözleşmeden ayrılsa görünmez.",
          "durum": "gözlendi",
          "dayanak": "schemas/deus-task.schema.json"
        }
      ]
    },
    "nerede": {
      "yanit": "Herkese açık GitHub deposu ve Pages yayını; beyana göre Haluk'un Y: sürücüsündeki kanonik klasör; Git dışında tutulan özel çalışma alanı.",
      "ogeler": [
        {
          "ad": "Herkese açık yüz",
          "aciklama": "HalukAINRS/ortak-kopru deposu, Pages yayını ve bu kesitte 26 dal ucu; araştırma ve devir malzemesi kendi dallarında durur.",
          "durum": "gözlendi",
          "dayanak": "docs/DEPO_REHBERI.md"
        },
        {
          "ad": "Kanonik klasör",
          "varyant": "nerede.gorulemez",
          "aciklama": "README'ye göre kanonik kopya Y:\\HalukAI\\Ortak_Kopru\\kopru\\ klasörüdür; bulut oturumundan görülemez.",
          "durum": "beyan",
          "dayanak": "README.md#yerleştirme"
        },
        {
          "ad": "Bulutta çalışan",
          "varyant": "nerede.calisir",
          "aciklama": "GitHub Actions'ta saatlik yanıtlayıcı (176 koşu, 28 Ekim'de de her saat başarılı), PR doğrulaması ve NT derlemesi.",
          "durum": "gözlendi",
          "dayanak": ".github/workflows/kopru.yml"
        },
        {
          "ad": "Yerelde çalışan",
          "varyant": "nerede.calisir",
          "aciklama": "Haluk'un Windows makinesinde PowerShell izleyicisi ve göndericisi, loopback'te yerel iş ekranı.",
          "durum": "beyan",
          "dayanak": "kopru_izle.ps1"
        }
      ]
    },
    "ne_zaman": {
      "yanit": "23 Ekim 2026 akşamı önce yerelde doğdu, 25 dakika sonra GitHub'a açıldı; defterin son kaydı 26 Ekim, ana dalın son birleşmesi 28 Ekim 09.25 UTC.",
      "ogeler": [
        {
          "ad": "Doğuş sırası",
          "aciklama": "k-0001 'Köprü açıldı' 19.55 UTC'de (22.55 UTC+3) yazıldı; GitHub deposu 20.20 UTC'de oluşturuldu.",
          "durum": "gözlendi",
          "dayanak": "kopru.html",
          "olcum": "ilk_kayit_zamani"
        },
        {
          "ad": "Son kayıt",
          "aciklama": "k-0179, 26 Ekim 19.40 UTC; sayfanın son güncellemesi aynı an.",
          "durum": "gözlendi",
          "dayanak": "kopru.html",
          "olcum": "son_kayit_zamani"
        },
        {
          "ad": "Sessizliğin başlangıcı",
          "varyant": "ne_zaman.beri",
          "aciklama": "Son çağrı günlüğü 24 Ekim 10.11 UTC, son atlama satırı 25 Ekim 12.41 UTC. Saatlik yanıtlayıcı koşmaya devam ediyor ama bulut yolları için bekleyen kayıt kalmadığından modeli çağırmıyor.",
          "durum": "gözlendi",
          "dayanak": "kayit/atlandi.log",
          "olcum": "son_gunluk_zamani"
        },
        {
          "ad": "Bekleyen kırılma",
          "varyant": "ne_zaman.bozulur",
          "aciklama": "Ana daldaki kayıt ekleyici Git-Portable-2.56.0.2 gibi bir sürüm adını IP sanar; bir bot bunu alıntıladığı an kayıt reddedilir ve iş akışı hata verir. Bu henüz olmadı.",
          "durum": "gözlendi",
          "dayanak": "kopru_ekle.py"
        }
      ]
    },
    "ne_kadar": {
      "yanit": "179 kayıt, 13 modüllük paket, 43 Python dosyası, 17 test dosyasında 226 test yöntemi, 6 sözleşme, 15 belge; çağrı günlükleri 122 dosyada 34 MB.",
      "ogeler": [
        {
          "ad": "Kod ve test",
          "aciklama": "Ana dalda 43 Python dosyası ve 10.267 satır; bunun 3.832 satırı 13 modüllük pakette; 17 test dosyasında 226 test yöntemi. Değerler bu oturumda ana dalın ayrı bir çalışma ağacında aynı araçla ölçüldü.",
          "durum": "gözlendi",
          "dayanak": "src/ortak_kopru/core.py"
        },
        {
          "ad": "Defter",
          "aciklama": "179 kayıt; 134'ü bir önceki kayda yanıt bağıyla bağlı, 167'sinin durum alanı açık. Gönderenler: Claude 84, ChatGPT 47, Copilot 31, Haluk 11, Gemini 6.",
          "durum": "gözlendi",
          "dayanak": "kopru.html",
          "olcum": "yanit_bagli_kayit"
        },
        {
          "ad": "Büyüme",
          "varyant": "ne_kadar.buyur",
          "aciklama": "Defter üç günde 179 kayda ulaştı, günde yaklaşık 60. Çağrı günlüklerinin baytlarının binde 973'ü, her çağrıda kopyalanan defterin kendisi. Ana dalda beş günde 228 commit birikti.",
          "durum": "gözlendi",